{
  "attestation_id": "nua_aop_01J000000000000000000000",
  "attestation_digest": "sha256:dea2222aa5074aca4d4ab7b97e874b42fbddd0a919b43d324be5d5fef07e425b",
  "tenant_id": "ten_01J00000000000000000000000",
  "execution_scope": {
    "kind": "artifact_operation",
    "artifact_operation_id": "aop_admission_failed_01J000000000000"
  },
  "commercial_authorization_id": "cauth_01J00000000000000000000000",
  "commercial_authorization_digest": "sha256:4db7c70af758d395510dddfeeb64901afd74c4b8a1fd6d3421ad19314b12f69e",
  "quota_reservation_id": "qres_01J00000000000000000000000",
  "quota_reservation_digest": "sha256:7373737373737373737373737373737373737373737373737373737373737373",
  "reason": "failed_before_dispatch",
  "evidence_reference": "ledger://artifact-operations/aop_admission_failed/no-dispatch-proof",
  "evidence_digest": "sha256:e48326f542de06f48ebc70339b189a25a922382e70a70a50366ff2cd17666c0b",
  "confirmed_at": "2026-07-16T09:07:30Z"
}
